<?xml version='1.0' encoding='UTF-8'?>
<!DOCTYPE panaderias SYSTEM "UD4_T4C_EloyRodalPerez.dtd">
<panaderias>
    <panaderia>
        <idPanadería>2</idPanadería>
        <telefono>986892207</telefono>
        <pedido numPedido="p2">
            <fecha>2024-03-07</fecha>
            <ingrediente>
                <idIngrediente>3</idIngrediente>
                <ano>2023</ano>
                <origen continente="America"/>
            </ingrediente>
            <ingrediente>
                <idIngrediente>4</idIngrediente>
                <ano>2024</ano>
                <origen continente="Africa"/>
            </ingrediente>
        </pedido>
    </panaderia>
    <panaderia>
        <idPanadería>3</idPanadería>
        <telefono>645423521</telefono>
        <pedido numPedido="p3" tipo="urgente">
            <fecha>2024-03-08</fecha>
            <ingrediente>
                <idIngrediente>5</idIngrediente>
                <ano>2024</ano>
                <origen continente="Europa"/>
            </ingrediente>
            <ingrediente>
                <idIngrediente>6</idIngrediente>
                <ano>2023</ano>
            </ingrediente>
        </pedido>
    </panaderia>
</panaderias>
